{
  "id": "base:promo_policy_change_3",
  "type": "event",
  "name": "loc:event.promo_policy_change_3",
  "description": "loc:event.promo_policy_change_3.description",
  "trigger": {
    "kind": "scheduled",
    "weight": 0.27,
    "earliest_day": 25,
    "act": 3
  },
  "effects": [
    {
      "op": "modify",
      "target": "rules_change",
      "amount": -0.18
    }
  ],
  "announced": true,
  "tags": [
    "rules_change",
    "case"
  ]
}
