{
  "id": "base:burst_pipe_2",
  "type": "event",
  "name": "loc:event.burst_pipe_2",
  "description": "loc:event.burst_pipe_2.description",
  "trigger": {
    "kind": "random",
    "weight": 1.41,
    "earliest_day": 60,
    "act": 2
  },
  "effects": [
    {
      "op": "modify",
      "target": "equipment",
      "amount": 0.3
    }
  ],
  "announced": false,
  "tags": [
    "equipment",
    "closure"
  ]
}
