{
  "id": "base:power_cut_2",
  "type": "event",
  "name": "loc:event.power_cut_2",
  "description": "loc:event.power_cut_2.description",
  "trigger": {
    "kind": "random",
    "weight": 0.38,
    "earliest_day": 40,
    "act": 2
  },
  "effects": [
    {
      "op": "modify",
      "target": "equipment",
      "amount": 0.37
    }
  ],
  "announced": false,
  "tags": [
    "equipment",
    "pressure"
  ]
}
