{
  "id": "base:regional_tournament_3",
  "type": "event",
  "name": "loc:event.regional_tournament_3",
  "description": "loc:event.regional_tournament_3.description",
  "trigger": {
    "kind": "scheduled",
    "weight": 1.15,
    "earliest_day": 40,
    "act": 3
  },
  "effects": [
    {
      "op": "modify",
      "target": "event",
      "amount": -0.02
    }
  ],
  "announced": false,
  "tags": [
    "event",
    "crowd"
  ]
}
